{
  "schemaVersion": 1,
  "changeId": "gse-169-context-orchestrator",
  "stateRevision": 7,
  "profile": "lite",
  "lifecycleStage": "specify",
  "lifecycleState": "specified",
  "sourceDigests": {
    ".gse/changes/gse-169-context-orchestrator/brief.md": "sha256:34b66a4e5ef112dbec4a52da580dc5ee922dd36b273caf3bc960df61b88ba7d7",
    ".gse/changes/gse-169-context-orchestrator/design.md": "sha256:2ede18d748d10c96b8cd4211b9ba14ba24a9e1892f624d2899247c98cfb1b249",
    ".gse/changes/gse-169-context-orchestrator/evidence.md": "sha256:4aef8ca774c91b9684d76e0942adb6dd9137bfdc4b635b77c23d08cb3ef6b175",
    ".gse/changes/gse-169-context-orchestrator/review.md": "sha256:077beb451789c0d0ce427951025b5f896050dec32155f8ccd9944b484a57afe3",
    ".gse/changes/gse-169-context-orchestrator/spec.md": "sha256:1636ce5b231e3ca35a38a76238570df511ab52f76937382b960e53a53cf0b28d",
    ".gse/changes/gse-169-context-orchestrator/tasks.md": "sha256:ef612c1b23dfe22279a7364ff0f79211adf37d8e08841135fd6453d4112cc5f5"
  },
  "derivedFrom": [
    ".gse/changes/gse-169-context-orchestrator/brief.md",
    ".gse/changes/gse-169-context-orchestrator/design.md",
    ".gse/changes/gse-169-context-orchestrator/evidence.md",
    ".gse/changes/gse-169-context-orchestrator/review.md",
    ".gse/changes/gse-169-context-orchestrator/spec.md",
    ".gse/changes/gse-169-context-orchestrator/tasks.md"
  ],
  "conflicts": []
}
